,title,answer
28,2018년 하반기 두원공조 합격자 자기소개서 01,"저는 `도전`과 `개척`을 제 진로 결정의 가치관으로 삼아왔습니다. 대학교 진학 시 경쟁력과 미래 가치를 가진 분야를 저의 전공으로 삼고 싶었고 항공우주공학과로 진학을 결정하였습니다. 진학 후 배운 전공을 활용하여 무선 자작 항공기 설계와 제작을 하는 동아리에 가입하여 활동하였고 전국 경진대회에 참가하여 입상까지 하였습니다. 조금 더 전문적인 능력과 나만의 장점을 키우고자 대학원에 진학하였고, 기체를 직접 활용하여 시험할 수 있는 풍동이 있고 기체 또는 유동으로부터 발생하는 소음을 측정 및 예측에 관한 연구를 하는 `공기역학 및 공력소음 실험실`에 입실하였습니다. 공부 또는 연구할 때, 혼자 계획하고 결정하는 것이 익숙하고 편했었지만, 동아리 활동과 실험실 생활을 경험하며 소통하고 공통의 목표를 위해 노력하는 방법을 익혀왔습니다. 저는 조직원으로 해야 할 역할과 책임을 갖고 `도전`과 `개척`의 정신으로 공통의 목표에 앞장서는 사람으로서 적합한 역량을 키워왔다고 생각합니다.   제가 두원기술연구소에 지원한 이유는 저의 경험이 연구소가 지닌 가치 및 연구를 잘 수행할 수 있다고 생각하기 때문입니다. 저의 석사 학위 논문은 프로펠러의 공력 성능과 소음 예측에 관한 주제로 회전하는 로터의 유동 특성과 발생하는 소음 특성에 관하여 연구를 해왔습니다. 논문 주제와 관련하여 `Open Rotor`, `Propeller Fan`에 관한 논문도 검토하고 참고하였고 추력 및 토크에 관한 이론을 공부하여 공력 성능 및 소음 예측을 하였습니다. 이를 측정하기 위하여 프로펠러와 로드셀을 설치하고 마이크를 방위각에 배치하여 실제 프로펠러 시험장치를 구성하였습니다. 또한, 실험실 연구 과제로써 산업통상자원부에서 주관하는 비행-등반 복합형 드론 개발 과제를 담당하며, 연구 및 회의 일정을 관리하고 각 팀원으로부터 연구 내용을 취합하여 평가 보고서를 작성하였습니다. 떄문에, 2년 동안 정부 과제를 진행하며 실무를 익힐 수 있었고 조직원으로서 역할을 익힐 수 있었습니다.   동축 반전 로터의 공력 성능 해석과 방사 소음예측을 위하여 BEMT와 주파수 영역의 음향상사식을 이용하여 예측하였고 실제 동축 반전 로터 실험장치를 구성하여 예측을 통한 비교 해석을 진행하였다. 또한 동축 반전 로터의 기구학적 설계 변수인 로터 사이 간격에 따른 공력 특성 및 소음 특성에 대한 해석을 수행하였다. 직경 약 660 mm의 프로펠러를 사용하여 동축 반전 로터의 제자리 비행 시험 장치를 구성하였고 두 로터의 간격에 따른 공력 성능과 소음을 측정하였다. 두 로터의 성능을 예측하기 위하여 프로펠러의 형상을 측정하고 BEMT를 사용하여 각각의 로터에 대한 공력 성능을 예측하였다. 또, 측정한 형상과 예측한 로터의 공력 성능을 이용하여 주파수 영역에서 두께 소음과 정상 하중 소음의 크기를 예측하였다. 측정된 공력 성능 및 공력 소음과 예측된 결과의 비교를 통하여 두 로터의 간격에 따른 성능과 특성에 대하여 분석을 진행하고 그 측정과 예측에 관한 방법을 제시하였다."
29,2018년 하반기 두산 합격자 자기소개서 01,"-두산의 성장 동력, 두산전자 / 융복합  두산전자는 스마트폰, Tablet PC와 같은 스마트 기기부터 LCD, 반도체, 자동차에 이르는 핵심소재를 개발·생산함으로서 지속적으로 성장해나가고 있습니다. 뿐만 아니라, 사업에 대한 투자만이 아닌 사람에 대한 투자는 앞으로의 성장 동력이 될 거라 생각 합니다. 저 역시 과학기술에 관심과 ‘전문가조직의 기초는 사람’이라는 직업적 가치관을 가지고, 인사 분야의 전문가가 되기 위해 지속적으로 노력하고 있습니다.  학부시절, 저는 과학기술법제론, 특허법, 지적재산법 노동법, 노사관계 등을 포함한 과학기술법학전공 72학점과 경영학전공 45학점을 들었습니다. 또한 14개월간 노무사를 준비하였고(17’ 1차 합격), 2번의 실무경험을 통해 이론을 체화시켰습니다. 저의 이러한 지식과 경험을 기반으로 두산   - 친화력과 원활한 커뮤니케이션  초·중·고·대학교를 모두 다른 지역으로 다니며 자연스럽게 스며진 친화력과 배려심은 커뮤니케이션을 할 때 그 빛을 바라곤 했습니다. 학부시절, '노사관계'수업에서 경영자 측의 역할로 단체교섭을 진행한 적이 있습니다. 처음에는 경영자대표팀과 노동자 대표팀 사이의 대립이 있었습니다. 이를 해결하기 위해 먼저 단체교섭 전에 종종 만나면서 친해지고자 노력하였습니다. 또한, 절대 효용이 아닌 총효용에 초점을 맞춰 단체교섭조항을 하나하나를 조정해 나갔습니다.  서로에 대한 배려의 자세 덕분에 “같은 문으로 들어와 다른 문으로 나간다.”라는 단체교섭을 웃으면서 마무리할 수 있었고, 이는 다양한 사람들과 협업해야 하는 인사업무를 수행하면서 도움이 될 것입니다.  하지만 생각이 많다는 것은 단점입니다. 그래서 집중해야 할 때 다른 생각이 들면, 손등에 ‘集中’란 한자를 적으며 집중하고자 노력합니다.   - 아이디어를 현실로, 특허출원  '스트레스가 심한 현대인을 위한 전화상의 힐링 플랫폼을 만들자' 라는 생각으로 특허출원을 결심하였습니다. 그러나 기술적으로 유사한 기존 특허들과의 차별점을 구현하는 것이 난제였습니다. 이를 위해 특허법 교수님과 변리사님과의 컨텍을 통해 아이디어를 구체화하였고, 결과적으로 ‘네트워크상에서 데이터 마이닝을 이용한 상담서비스 플랫폼 제공방법’이라는 특허출원을 할 수 있었습니다.  저는 이에 그치지 않고, ‘이 아이디어가 사업화되면 어떨까?’라는 생각으로 컴퓨터사이언스를 전공한 분과 컴퓨터 소프트웨어를 전공한 분과 함께 창업공모전을 준비하면서 비즈니스를 구축하고 UI를 설계했습니다. 또한 테블로 통해 데이터를 분석하여 전문가들 앞에서 프레젠테이션을 진행하였고 공모전수상을 할 수 있었습니다.  이처럼 도전적인 목표를 설정하고, 이를 해결하기 위해 실천하는 저의 모습은 두산전자의 다양한 리스크 환경에서의 실효성 있는 해법을 모색하여 법적 안정성과 정도경영을 추구할 수 있도록 도움이 될 것입니다. 또한 입사 후 특허출원경험을 살려 R&D 인재를 포함한 다양한 직무에 적합한 세분화된 경력개발 프로그램을 구축하고 싶습니다. 이를 통해 종업원들이 매너리즘에 빠지는 것을 극복하고, 종업원들의 만족감과 동기부여 제고효과에 기여하겠습니다."
30,2018년 하반기 동아쏘시오홀딩스 합격자 자기소개서 01,"# 첫 만남에도 어색하지 않은 사람 저는 많은 사람으로부터 '재완이 너는 처음 만났는데, 어색하지가 않다'라는 말을 가장 자주 들어왔습니다. 대학교에 입학하며 저는 누구와도 친해질 수 있는 사람이 되고자 스스로 다짐했습니다. 이를 위해 수많은 서적과 강의를 통해 지식을 쌓고, 다양한 조직에서 사람을 만날 때 배운 내용을 실제로 활용하며 지식을 체득화해왔습니다. 그 결과 학부 시절 소통 역량을 인정받아 금융학회에서 비전공자지만 팀장이 될 수 있었으며, 그 과정에서 맺은 소중한 인연들 덕분에 인턴 등 다양한 기회까지 얻을 수 있었습니다. 이처럼 저는 매 순간 제가 만나는 사람들과 항상 긍정적인 관계를 맺고자 노력해왔고, 그 관계들을 바탕으로 성장하고, 성과를 이뤄내 왔습니다. 이제는 이러한 소통 역량을 살려 동아쏘시오홀딩스 이해관계자들과 소통하여 이를 바탕으로 양질의 교육을 제공해 함께 성장하는 데 이바지하고자 합니다.   # Just Do It 지금까지 저는 새로운 것을 두려워하지 말고 항상 도전하자는 것을 가치관으로 삼고 살아왔습니다. 고등학교 시절 우연히 교내 축제에 댄스팀을 꾸려 친구들과 도전한 적이 있습니다. 당시 저는 조용히 책만 읽는 어디에서나 볼 수 있는 평범한 아이였습니다. 하지만 제 생애 처음으로 낯선 댄스 분야에 도전하며, 목표를 이루기 위해 노력하는 과정에서 몰입의 즐거움을 느낄 수 있었습니다. 그 후 목표를 이루었고, 성취감과 더불어 새로움에 대한 두려움도 떨쳐낼 수 있었습니다. 대학생이 된 후에는 경계를 뛰어넘는 도전을 하고자 노력했습니다. 사범대생이지만 전략기획, 금융 등 다양한 분야에서 도전하고 경험했습니다. 그리고 그 결과 전략기획 인턴에서는 전략적 사고를, 금융 학회와 인턴을 하며 데이터 분석력을 기르는 등 스스로 성장까지 이뤄낼 수 있었습니다. 이처럼 저는 'Just Do It'이라는 좌우명을 바탕으로 끊임없이 새로움, 한계에 도전하며 성장할 수 있었습니다.   # 경영환경에 대한 분석역량 기업교육의 목적은 개인의 역량 개발을 넘어, 조직의 발전까지 이어져 있다는 특수성이 있습니다. 그리고 이러한 특수성을 위해서 교육담당자는 경영환경에 대한 전반적인 이해 및 분석역량이 필수적입니다. 미래의 경영환경을 고려하지 않은 교육은 구성원들의 미래 경쟁력과 성장에 이바지할 수 없는 교육이기 때문입니다. 저는 금융 학회, 인턴 활동을 하며 약 50여 개의 기업을 분석하며 산업에 따른 경영환경의 차이를 배우고 이에 대한 분석력을 키울 수 있었습니다. 이러한 분석역량은 지주회사의 교육 담당자로서 다양한 산업 구성원들의 교육을 수행하는 데 있어 가장 필요한 역량이라고 생각합니다.  # 맞춤형 교육을 위한 소통역량 교육에 있어 가장 기본은 학습자의 특성을 이해하는 것입니다. 그렇기에 기업 교육 업무를 수행하기 위해서는 학습자의 고유 특징을 이해하고 이를 바탕으로 과정을 설계할 수 있는 역량이 필수적입니다. 저는 학부 시절 '기업교육론', '인적자원개발론' 등의 수업을 통해 성인학습자의 특성과 다양한 직무에 대해 배울 수 있었습니다. 그리고 이러한 지식을 활용해 학회 내에서 약 30명의 신입 구성원 대상 교육을 맞춤형 교육으로 재구성해 성과를 낸 경험이 있습니다. 이처럼 저의 학습자 위주 교육에 대한 지식과 경험은 구성원들에게 맞춤형 교육을 제공하는 데 있어 가장 필요한 역량일 것입니다.   # 내 강점을 살릴 수 있는 직무 학부 시절 저만의 강점인 소통능력과 더불어 학생에 대한 분석력을 바탕으로, 선생님으로서 인정을 받을 수 있었습니다. 그러던 중 전공을 배우며 기업 교육 직무에 제가 가진 강점이 적합하다는 것을 알 수 있었고, 그 뒤 이를 바탕으로 학회에서 교육 업무를 수행하며 이것들이 교육에 있어 강점임을 확인할 수 있었습니다. 이제는 학부 시절 배운 지식과 제 역량을 더 크게 발휘해보고자 HRD 직무에 지원하게 되었습니다.  # 내 가치관을 살릴 수 있는 회사 동아쏘시오홀딩스는 단순히 제약, 물류, 포장 용기 사업뿐만 아니라 지주회사로써 그룹 내 전체에 대한 시각이 필요하다는 특수성이 있습니다. 그렇기에 교육담당자는 최적화된 교육을 제공하기 위해 항상 경계를 넘어 도전하고, 최고의 성과를 내야 합니다. 이처럼 동아쏘시오홀딩스라면 제가 가진 도전정신이라는 가치관을 가장 잘 살릴 수 있고, 그 과정에서 함께 성장할 수 있다는 확신이 들어 지원하게 되었습니다.   경험 및 경력기술서(최대 500자 입력가능) ＃ 맞춤형 교육을 통해 높인 교육 집중도 학회활동 당시 학회 내에서 신입학회원 대상으로 한 교육의 집중도가 낮다는 문제가 제기되었습니다. 이를 해결하기 위해 저는 과거 신입이었던 구성원들의 의견을 수집하고, 교육 현장에 직접 참여해 교육 환경을 분석하여 문제의 원인을 파악하고자 했습니다. 그리고 그 결과 학습자와 교육자 간의 수준 차가 원인임을 알 수 있었습니다. 당시 교육자는 현업 팀장들이었기에 그들의 수준에서 교육했고, 반면에 학습자 중에는 비전공자도 있었기에 교육의 내용이 너무 어려웠던 것이었습니다. 이를 해결하기 위해 교육의 난이도를 낮추고, 예시를 일상생활 위주로 바꿨습니다. 이와 더불어 지식의 전달과 학습이라는 학회의 본 목적을 잃지 않기 위해 기존의 멘토 제도를 강화했습니다. 이렇게 교육의 난이도 및 교육 방법이 바뀌자 신입 학회원들은 흥미를 갖고 수업에 집중하기 시작했고, 집중도가 높아졌을 뿐만 아니라 교육 후 학회 활동에 대한 몰입감도 높아졌습니다."
31,2018년 하반기 대한항공 합격자 자기소개서 03,"저의 목표는 4차 산업을 이끌어가는 일류 무인기 엔지니어가 되는 것입니다. 대학 3학년 때, 제품개발설계 과목을 수강하면서 4차 산업을 이끌어나갈 주요 분야 중 드론에 대해 조사를 했던 경험이 있습니다. 드론 및 무인기가 세상에 가져와 줄 변화에 흥미를 느꼈고 무인기 엔지니어가 되겠다는 목표를 가지게 되었습니다. 대한항공 테크 센터에서 무인기 핵심 부품들을 설계, 제작하여 우리나라 무인기 발전을 이끌어나가겠습니다.  이를 위해 제가 가지고 있는 경쟁력은 다음과 같습니다.  첫째, 산업기능요원으로 생산기술팀에서 3년간 근무해서 기술직무에 대한 높은 이해도를 가지고 있습니다. 기술직무가 어떤 일들을 하는지와 추구하는 방향에 대해서 배웠습니다. 샘플제작업무를 통해 현장에서 생산 공정과정을 익혔습니다. 이러한 현장 경험을 바탕으로 항공기 생산에도 빠르게 적응해 나가겠습니다. 둘째, 4대 역학, 기계진동, 응용열전달 등 기계의 전반적인 원리를 파악할 수 있는 전공지식을 가지고 있습니다. 특히 항공기 부품은 안전성이 가장 우선시 됩니다. 제가 가진 전공지식을 활용하여 안전한 항공기 생산에 기여하겠습니다.     산업기능요원으로 근무하며 샘플업무를 담당하며 있었던 경험을 꼽고 싶습니다. 샘플업무는 고객사에서 개발용 부품으로 요청하는 제품을 대응하는 일이었습니다. 입사를 하였을 때는 보조역할로 시작하였지만 1년 6개월 후에는 샘플업무 전반을 혼자 담당하게 되었습니다. 한번은 고객사에서 오차범위 0.5%인 정밀급 전자제품 샘플을 요청해서 샘플을 제작해야했습니다. 당시 회사에서 주로 판매하는 제품은 5% 오차였기 때문에, 주간회의에서 소량의 샘플대응은 당장 가능할지라도 양산주문이 들어오면 지금 시스템으로는 힘들다는 의견을 말씀드렸습니다. 제 의견이 반영되어 샘플제작을 하면서 양산주문에 대비해 여러 번의 테스트를 거치게 되었습니다. 같은 제품을 20번 이상 반복 제작하는 테스트를 통해 작업조건을 정해나갔습니다. 정밀 급에 대한 작업표준이 새롭게 생기게 되었고 실제로 이후에 양산주문이 100만개 이상 들어와 성공적으로 작업을 마칠 수 있었습니다. 항공기 제작에 있어서도 명확한 상황판단이 중요합니다 이러한 역량을 기반으로 유능한 엔지니어로 거듭나 대한항공이 세계 최고의 무인기 및 종합 항공우주업체가 되는데 제 역할을 다하겠습니다.     소통하는 자세가 협업하는데 있어 중요한 역량이라고 생각합니다. 창의공학설계 과목에서 텀프로젝트 팀장을 맡은 적이 있습니다. 5명이 한 조가 되어 1학기 동안 레고로봇을 만들고, 상대방 진영으로 공을 넘기는 미션을 완수하는 프로젝트였습니다. 로봇의 하드웨어, 프로그래밍, 발표 및 보고서 파트로 역할분담을 나누고 진행을 하였지만 좀처럼 진전이 되지 않았습니다. 하드웨어를 변경함에 따라 프로그래밍 또한 바뀌어야했기 때문에 조원들 간의 갈등도 쌓였습니다. 또한 미션을 수행해나가는 창의적인 방법에서도 의견이 달라 원점으로 돌아가는 마찰이 있었습니다. 이를 개선하고자 두 가지 노력을 하였습니다. 첫째, 프로그래밍 파트 조원들의 어려운 점을 모든 조원들이 들을 수 있는 자리를 만들어 어떻게 부담을 덜어줄 수 있을지 상의를 하였습니다 둘째, 개개인의 미션 해결 방법을 얘기하고 그에 대한 피드백을 거쳐 최종적으로 한 가지 방법을 결정하였습니다. 이를 통해 조원간의 갈등이 누그러지고 마음이 맞아지자 프로젝트의 속도가 붙었습니다. 입사 후에도 끊임없는 소통을 통해 팀원과 협업해서 성과를 이뤄나갈 것 입니다.    리더는 조직의 성과에 집중하는 사람으로서 이를 위해 조직 안과 밖의 사람들과 활발히 소통하는 역량이 필요합니다. 참모는 조직의 비전을 정확히 이해하고 이를 조직 전반에 퍼트리고 조직소통이 성과로 이어지도록 조직의 허리와 같은 역할을 하는 사람입니다. 저는 리더라고 생각합니다. 샘플업무 당시, 일정 내에 샘플을 제작하기 위해 여러 조직들과의 소통이 필수적이었습니다. 생산라인에서 샘플제작을 하면 양산이 미뤄진다는 이유로 마찰이 있었습니다. 이를 해결하기 위해 샘플이 우선시 되어야하는 이유를 들며 설득하였습니다. 또한 상대방을 존중해주고 친밀해지는 게 중요하다고 생각해, 매일 아침 모든 라인을 돌면서 인사드리고 항상 밝은 표정으로 대했습니다. 노력의 결과로 처음에 부탁하면 무조건 안 된다고 하셨던 분들이 그 후에는 당장은 왜 못해주는지, 언제 작업이 가능한지 얘기해주셨습니다. 또한 생산관리부서와의 소통을 통해, 양산스케줄을 유동적으로 조정하여 샘플 작업을 진행하였습니다. 이러한 결과 일정을 2~3일 앞당길 수 있었습니다. 입사 후에도 조직안과 밖의 사람들과 소통하여 제가 맡은 임무를 반드시 완수하는 엔지니어가 되겠습니다."
32,2019년 상반기 대한항공 합격자 자기소개서 01,"[글로벌 시대의 대한항공 서비스 리더] 대한항공은 대한민국을 대표하는 명실상부 명품항공사입니다. 하지만 최고의 위치에 안주하지 않고, 컨시어지 서비스, 조인트벤처 등 승객의 편의 개선을 위한 서비스 강화 방법을 끊임없이 모색하고 있습니다. 이러한 대한항공의 지속적인 성장에 기여할 수 있는 인재가 되기 위해 두 가지 노력을 해왔습니다. 첫째, 유니클로, 어학원 근무 등 대고객 서비스 수행 경험을 쌓으며 고객지향성을 기르고자 노력했습니다. 어학원 근무 당시, 고객의 VOC에 귀 기울이고 적극적으로 개선해나가 고객만족도 100%를 달성한 경험이 있습니다. 둘째, 한국문화학교 봉사활동, 외국인 진료소 봉사활동의 경험을 통해 글로벌 서비스 역량을 강화하고자 했습니다. 국제학교 시절 기른 글로벌 문화 이해력을 바탕으로, 다국적 고객의 만족을 끌어내는 서비스를 제공했습니다. 뿐만 아니라, 지속적으로 제2외국어 공부를 하며 자기계발을 해왔습니다. 이렇듯 고객지향성과 국제적 감각을 바탕으로 한 강한 서비스 정신을 발휘하여, 대한항공의 프리미엄 서비스 경쟁력을 높이고 안전 부문에서 새로운 가치를 창출하는 기내승무원이 되고 싶습니다.   [진취성, 변화를 이끈 원동력] 000대학병원 외국인진료소에서 봉사활동을 했습니다. 프랑스, 중국 등 다국적 환자를 위한 통번역 및 병원 안내 서비스를 제공한 때, 진취성을 발휘하여 고객들의 불편을 해소하고 만족을 끌어낸 경험이 있습니다. 외국인 환자분들이 병원 내에서 길을 잃고, 접수 절차를 몰라 우왕좌왕하는 일이 빈번하게 일어났습니다. 이러한 문제를 개선하고자 저는 병원 내부 지도를 그린 설명서를 제작했습니다. 직접 병원을 돌아다니며 환자들이 많이 방문하는 과의 위치를 확인했고, 진료 후 수납하는 접수 절차를 명시해 두었습니다. 설명서 제작 후, 방문 장소를 지도상으로 체크하고 접수 절차를 설명해 드렸습니다. 그러자 환자분들의 빠른 이해를 도울 수 있었고 업무의 효율성을 높일 수 있었습니다. 지도를 사진 찍어 가시는 분들을 보며 뿌듯함을 느꼈습니다. 최고의 서비스는 '고객의 마음을 헤아리고 행동하는 일'이라 생각합니다. 비록 거창하진 않지만, 그런 의미에서 이 경험은 문제점 개선을 통해 고객의 만족이라는 변화를 끌어냈기에 최고의 서비스였다고 생각합니다.   [팀워크의 시작은 배려] 미국 교환학생 시절, 다국적 조원들과 기업의 마케팅 사례 발표 과제를 수행했습니다. 하지만 문화 배경이 다른 팀원들과 과제를 수행하는 일에는 어려움이 따랐습니다. 영어가 서툴러 원활한 의사소통이 힘든 중국인 팀원이 소외되어 갈등이 생겼기 때문입니다. 이때 저는 발표에 연극적 요소를 가미해 모든 팀원이 참여할 수 있도록 발표 방향 수정을 제안했습니다. 6명의 팀원을 소품 제작팀, 대본팀의 2팀으로 나누어 발표 준비를 마쳤습니다. 저는 별도로 시간을 내어 중국인 팀원의 대본 연습을 도와주었고, 완성도를 높이기 위해 팀원들과 모여 끊임없이 연습했습니다. 그 결과, 연극 발표로 사례의 이해도를 높인 점과 팀워크가 돋보였다는 교수님의 긍정적인 피드백을 받았습니다. 소외되는 인원 없이 팀원 모두가 공동의 목표를 달성하기 위해 협업하였기에 만들 수 있었던 결과물이었습니다. 이를 계기로 저는 팀원들과의 공감과 교류를 더욱 중시하는 사람이 되었습니다."
